{
  "requester_id": "11111111-1111-4111-8111-111111111111",
  "requester_class": "trusted_app_surface",
  "app_context": {
    "app_id": "forge-author",
    "app_version": "1.0.0",
    "installation_id": "22222222-2222-4222-8222-222222222222"
  },
  "environment_mode": "prod",
  "trust_basis": "signed_local_surface",
  "trust_basis_provenance": "signed_manifest",
  "user_intent_basis": "explicit_user_action",
  "request_nonce_or_token": "signed-token-2030-0001",
  "issued_at": "2029-12-31T23:00:00Z",
  "expires_at": "2030-01-02T00:00:00Z"
}
